[
  {
    "id": "EVID-001",
    "company": "Google",
    "topic": "Project Nimbus Tender Award",
    "claim": "Google and Amazon were jointly awarded the $1.2 billion Project Nimbus contract by the Israeli government to provide comprehensive cloud and AI services.",
    "status": "VERIFIED",
    "source_tier": "Tier 1",
    "source_type": "Government Tender / Ministry Announcement",
    "source_title": "Israel Ministry of Finance Announces Winners of Government Cloud Tender (Nimbus)",
    "source_url": "https://www.gov.il/en/departments/news/press_21042021",
    "publication_date": "2021-04-21",
    "quote_or_evidence": "The tender committee headed by the Accountant General announced that Google and AWS are the winning providers for Project Nimbus, providing cloud services to government ministries and other public sector entities.",
    "counterclaim_or_nuance": "Google asserts that the Nimbus contract is intended for standard commercial workloads of civilian government ministries such as transportation, healthcare, and education.",
    "last_verified": "2026-09-15"
  },
  {
    "id": "EVID-002",
    "company": "Google",
    "topic": "Ministry of Defense Cloud Expansion",
    "claim": "Google negotiated direct cloud computing and consulting contracts with the Israeli Ministry of Defense during active military operations in Gaza.",
    "status": "STRONGLY_SUPPORTED",
    "source_tier": "Tier 2",
    "source_type": "Investigative Journalism",
    "source_title": "Time Magazine: Google's Project Nimbus Contract With Israel's Ministry of Defense Revealed",
    "source_url": "https://time.com/6966102/google-contract-israel-defense-ministry-gaza/",
    "publication_date": "2024-04-12",
    "quote_or_evidence": "According to a company document viewed by TIME, the Israeli Ministry of Defense has its own 'landing zone' into Google Cloud, with dedicated consulting services and expanded compute capacity requested during the military campaign in Gaza.",
    "counterclaim_or_nuance": "Google stated that its work is commercial and not directed at highly sensitive or classified military intelligence workloads or weapons development.",
    "last_verified": "2026-09-15"
  },
  {
    "id": "EVID-003",
    "company": "Google",
    "topic": "Local Datacenter Region (me-west1)",
    "claim": "Google Cloud opened a dedicated cloud region in Tel Aviv in November 2022 to provide in-country data residency under Project Nimbus requirements.",
    "status": "VERIFIED",
    "source_tier": "Tier 1",
    "source_type": "Corporate Press Release",
    "source_title": "Google Cloud Launches Region in Tel Aviv, Israel",
    "source_url": "https://cloud.google.com/blog/products/infrastructure/google-cloud-region-in-tel-aviv-now-open",
    "publication_date": "2022-11-02",
    "quote_or_evidence": "Today, we are announcing the official opening of the Google Cloud region in Tel Aviv (me-west1), bringing local infrastructure to customers across Israel.",
    "counterclaim_or_nuance": "Google emphasizes that regional infrastructure is standard for multi-national public cloud operations to reduce latency and comply with local data protection regulations.",
    "last_verified": "2026-09-15"
  },
  {
    "id": "EVID-004",
    "company": "Google",
    "topic": "Employee Protests and Mass Terminations",
    "claim": "Google dismissed over 50 employees who participated in sit-in protests against Project Nimbus at company offices in Sunnyvale and New York.",
    "status": "VERIFIED",
    "source_tier": "Tier 1",
    "source_type": "National Labor Relations Board (NLRB) Filings / AP News",
    "source_title": "AP News: Google fires dozens of workers after office protests over Israel cloud contract",
    "source_url": "https://apnews.com/article/google-workers-fired-israel-protest-nimbus-3c58f003ae6a02b113fe74044ffc9779",
    "publication_date": "2024-04-18",
    "quote_or_evidence": "Google fired more than 50 workers in the weeks following demonstrations at its California and New York offices, citing policy violations regarding disruptive behavior and workplace safety.",
    "counterclaim_or_nuance": "Google leadership stated the firings were strictly due to insubordination, office property disruption, and harassment of colleagues, not retaliation for political opinions.",
    "last_verified": "2026-09-15"
  },
  {
    "id": "EVID-005",
    "company": "Amazon",
    "topic": "Project Nimbus Mandatory Service Clauses",
    "claim": "Project Nimbus tender terms legally bind AWS and Google to provide uninterrupted cloud services and prohibit withholding services from defense entities.",
    "status": "STRONGLY_SUPPORTED",
    "source_tier": "Tier 2",
    "source_type": "Investigative Journalism / Leaked Tender Analysis",
    "source_title": "The Guardian / +972 Magazine: Secretive terms of Israel's Project Nimbus cloud deal",
    "source_url": "https://www.theguardian.com/technology/2022/aug/18/google-amazon-project-nimbus-israel-contracts",
    "publication_date": "2022-08-18",
    "quote_or_evidence": "The contractual conditions reportedly prevent the tech providers from halting services to any Israeli government branch or complying with international boycotts, and require notification if foreign courts demand user data.",
    "counterclaim_or_nuance": "Commercial terms are standard government procurement requirements designed to prevent service interruptions for vital public utilities.",
    "last_verified": "2026-09-15"
  },
  {
    "id": "EVID-006",
    "company": "Amazon",
    "topic": "AWS Israel Region and $7.2B Investment",
    "claim": "AWS launched the AWS Israel (Tel Aviv) Region in August 2023, committing an estimated $7.2 billion in infrastructure investment through 2037.",
    "status": "VERIFIED",
    "source_tier": "Tier 1",
    "source_type": "Corporate SEC / Press Announcement",
    "source_title": "AWS Launches Region in Israel (il-central-1)",
    "source_url": "https://press.aboutamazon.com/2023/8/aws-launches-region-in-israel",
    "publication_date": "2023-08-01",
    "quote_or_evidence": "Amazon Web Services today announced the launch of the AWS Israel (Tel Aviv) Region, enabling customers to run workloads and store data in Israel. AWS plans to invest an estimated $7.2 billion through 2037.",
    "counterclaim_or_nuance": "AWS states the investment is driven by high cloud demand among Israeli enterprise, startup, and civilian government sectors.",
    "last_verified": "2026-09-15"
  },
  {
    "id": "EVID-007",
    "company": "Amazon",
    "topic": "West Bank Settlement Delivery Controversy",
    "claim": "In 2020, Amazon offered free retail shipping to illegal West Bank settlements while charging Palestinian residents fees, which was resolved after civil rights outcry.",
    "status": "VERIFIED",
    "source_tier": "Tier 2",
    "source_type": "Major Investigative Journalism",
    "source_title": "The Guardian: Amazon extends free shipping to Palestinians after discrimination outcry",
    "source_url": "https://www.theguardian.com/technology/2020/mar/04/amazon-free-shipping-palestinians-west-bank",
    "publication_date": "2020-03-04",
    "quote_or_evidence": "Amazon announced it would extend its free shipping promotion to Palestinian customers in the occupied West Bank after an investigation revealed it offered free shipping only to Jewish settlements.",
    "counterclaim_or_nuance": "Amazon claimed the initial disparity was a logistical customs and addressing issue, which it resolved by expanding address recognition in Palestinian territories.",
    "last_verified": "2026-09-15"
  },
  {
    "id": "EVID-008",
    "company": "Microsoft",
    "topic": "Azure Enterprise and Defense Ministry Supply",
    "claim": "Microsoft supplies enterprise IT, operating systems, and Azure cloud services to the Israeli Ministry of Defense and armed forces.",
    "status": "VERIFIED",
    "source_tier": "Tier 1",
    "source_type": "Government Procurement Filings / Company Disclosures",
    "source_title": "Israeli Government Procurement Portal - Microsoft Enterprise Licensing",
    "source_url": "https://www.gov.il/en/departments/dynamiccollectors/tenders-procurement",
    "publication_date": "2022-06-15",
    "quote_or_evidence": "Microsoft has long-standing enterprise agreements providing software licensing, cloud compute, and technical support across Israeli defense and administrative branches.",
    "counterclaim_or_nuance": "Microsoft did not win the Project Nimbus tender (which was won by Google and AWS), and operates under distinct enterprise frameworks.",
    "last_verified": "2026-09-15"
  },
  {
    "id": "EVID-009",
    "company": "Microsoft",
    "topic": "Unit 8200 Surveillance, Lavender AI & 2025 Access Termination",
    "claim": "The Guardian and +972 Magazine revealed Israeli military intelligence (Unit 8200) stored mass surveillance data and powered AI targeting systems (Lavender) on Microsoft Azure, prompting Microsoft in September 2025 to terminate military access to specific surveillance tools.",
    "status": "VERIFIED",
    "source_tier": "Tier 1",
    "source_type": "Investigative Journalism / Corporate Compliance Records",
    "source_title": "The Guardian & Business & Human Rights Resource Centre: Microsoft cuts off Israeli military access to surveillance tools",
    "source_url": "https://www.business-humanrights.org/en/latest-news/microsoft-surveillance-israel-military-cut-off/",
    "publication_date": "2025-09-20",
    "quote_or_evidence": "Investigations revealed Unit 8200 utilized segregated areas in Microsoft Azure to process mass phone interceptions and feed AI targeting systems like Lavender (37,000 targets). Microsoft confirmed an internal review and disabled access to specific Azure surveillance capabilities for an Israeli military unit under its Acceptable Use Policy.",